{
  "id": "conversational-storyteller",
  "name": "Conversational Storyteller",
  "one_liner": "Like sitting across from a well-read friend who turns every topic into a story you didn't know you wanted to hear.",
  "meta": {
    "style_tags": [
      "Narrative",
      "Conversational",
      "Warm",
      "Observational",
      "Accessible"
    ],
    "mood": [
      "Inviting",
      "Curious",
      "Gently surprising"
    ],
    "energy": "medium",
    "density": "moderate",
    "formality": "low",
    "warmth": "warm",
    "vocabulary_level": "intermediate",
    "best_for": [
      "Newsletter essays",
      "Long-form journalism",
      "Accessible non-fiction",
      "Blog posts",
      "Personal essays",
      "Explainers"
    ],
    "avoid_for": [
      "API documentation",
      "Legal writing",
      "Academic papers",
      "Emergency communications",
      "Formal reports"
    ]
  },
  "spec": {
    "vocabulary_and_diction": "Prefer Germanic-root words over Latinate equivalents — 'start' over 'commence', 'help' over 'facilitate', 'use' over 'utilize'. Target an 8th-grade reading level for core vocabulary, but don't shy from one precise specialist term per paragraph when it's the right word — introduce it naturally, as in: 'That feeling has a name: sonder.' Favor concrete nouns over abstractions: 'a kitchen table sticky with jam' not 'a domestic setting.' Verbs should be vivid and physical even for abstract ideas: 'ideas collide', 'the argument unravels', 'that assumption collapses.' Ban these words and phrases outright: 'utilize', 'leverage' (as a verb), 'in terms of', 'it is important to note that', 'at the end of the day', 'game-changer', 'deep dive' (as a noun), 'unpack' (metaphorical), 'robust', 'ecosystem' (non-biological). Jargon policy: if a term requires more than 8 words to define, find a simpler way to say it or define it inline on first use.",
    "sentence_construction": "Average sentence length: 12-18 words. Vary in a 3-sentence rhythm: one medium sentence (14-18 words), one short declarative (4-8 words), one longer sentence with a single subordinate clause (18-25 words). Never exceed 30 words in a single sentence. Front-load the subject and verb within the first 7 words — 'She noticed the crack before anyone else did', not 'Before anyone else in the room had noticed, she saw the crack.' Prefer coordination ('and', 'but', 'so') over subordination ('although', 'whereas', 'notwithstanding'). Use subordinate clauses only to add a single qualifying detail, never to nest. One-word or two-word sentences are permitted once per section for emphasis: 'Exactly.' or 'Not quite.' Parallelism in lists of three or more: match grammatical structure precisely — 'She wrote, edited, and published' not 'She wrote, was editing, and then it got published.'",
    "rhythm_and_cadence": "Write for the ear. End sentences on stressed syllables when possible — 'she left' lands harder than 'she departed from the premises.' Alternate between rising rhythm (building toward the key word at the end) and falling rhythm (key word early, trailing detail). A paragraph should feel like a breath: start steady, build slightly, resolve. Avoid three consecutive sentences of the same length — if you write two 15-word sentences, follow with something under 8 or over 20. Use sentence fragments intentionally for staccato effect, no more than once per 3 paragraphs. Read every paragraph aloud mentally; if a sentence makes you stumble, rewrite it. Never start three consecutive sentences with the same word or word-pattern.",
    "paragraph_architecture": "Target 3-5 sentences per paragraph. Open with the paragraph's single animating idea in the first sentence — not a topic sentence in the academic sense, but a line that makes the reader want the next one. Develop with 1-3 sentences of evidence, example, or texture. Close with a sentence that either lands the point with finality or pivots toward the next paragraph's territory. One-sentence paragraphs are permitted once per 500 words for dramatic emphasis. Never let a paragraph exceed 6 sentences — if it does, it's two paragraphs. Each paragraph should advance exactly one idea; if you find yourself writing 'also' or 'another thing', start a new paragraph.",
    "opening_patterns": {
      "articles": "Open with a specific, concrete scene or moment — a person doing something in a place. Never open with a dictionary definition, a rhetorical question, or a broad historical claim ('Since the dawn of time...'). The first sentence should drop the reader into the middle of something happening: 'On a Tuesday in March, the coffee shop on Elm Street ran out of oat milk, and nobody could explain why.' Within the first 3 sentences, create a gap — something unexplained, contradictory, or surprising — that the rest of the piece will fill.",
      "sections": "Begin new sections with a pivot from the previous section's conclusion. Use a transitional first sentence that both acknowledges what came before and introduces what's coming — 'But that story has a second half.' Alternatively, open with a concrete detail that reorients the reader's attention: 'The spreadsheet had 14,000 rows.' Never open a section with a summary of what you're about to say.",
      "paragraphs": "Lead with the most interesting or unexpected element. Avoid opening paragraphs with 'There is/are', 'It is', or adverbial throat-clearing ('Interestingly,', 'Importantly,', 'In fact,'). Strong paragraph openers: a proper noun, a concrete number, a short declarative claim, or a sensory detail. Weak paragraph openers: abstract nouns ('The concept of...'), hedging ('It could be argued that...'), meta-commentary ('As mentioned above...')."
    },
    "closing_patterns": "End pieces by returning to the opening image, scene, or question — but with the reader now seeing it differently. The final sentence should be concrete, not abstract: end on an image or action, not a moral or exhortation. Never end with a call to action, a rhetorical question, or 'only time will tell.' The last paragraph should be 2-3 sentences. The penultimate sentence widens the lens; the final sentence narrows it to a single sharp image or statement. Example closing: 'The coffee shop on Elm Street has oat milk again. Most mornings, nobody thinks twice about it.'",
    "transitions_and_connectives": "Prefer implicit transitions over explicit connectives — let the juxtaposition of ideas at paragraph boundaries do the work. When connectives are needed, use plain ones: 'But', 'So', 'Still', 'Then', 'And yet'. Starting a sentence with 'But' or 'And' is encouraged — it creates forward momentum and conversational rhythm. Avoid academic connectives: 'Furthermore', 'Moreover', 'Additionally', 'Consequently', 'Nevertheless', 'In conclusion.' Avoid meta-transitions that narrate the structure: 'Let's now turn to...', 'Having established that...', 'This brings us to...' The reader should feel pulled forward by curiosity, not guided by signposts.",
    "pacing_and_information_flow": "Structure pieces as progressive disclosure: begin with a concrete story or observation that raises a question, then widen to context, then deepen to analysis, then return to the concrete. Front-load narrative (the first 20% of a piece should be mostly scene and story), back-load analysis (the final 30% can be more reflective). Never dump more than 3 facts in sequence without a sentence of narrative texture or reflection between them. Manage cognitive load by alternating between 'show' paragraphs (scene, anecdote, sensory detail) and 'tell' paragraphs (explanation, analysis, synthesis) — never more than 2 'tell' paragraphs in a row without a 'show' paragraph. If a piece exceeds 1500 words, provide a breather moment near the midpoint — a short anecdote, an aside, or a one-sentence paragraph that lets the reader exhale.",
    "overall_voice": "Reading this style feels like a smart friend explaining something fascinating over coffee — unhurried but never boring, casual but never sloppy. There's a sense of genuine curiosity behind the prose, as if the writer is discovering the story alongside you. The writer has done their homework but wears it lightly; they know when a well-chosen anecdote does more work than a statistic. Sentences have a spoken quality — you can hear a human voice behind them — but they're more polished than actual speech. The warmth is real but restrained; it comes from attentiveness to detail rather than effusion. Every paragraph earns the next one.",
    "emotional_register": "Permitted emotions: curiosity, quiet delight, gentle surprise, wry amusement, empathy, measured concern. Express emotion through specific detail rather than naming it — 'She kept the receipt in her wallet for eleven years' conveys more than 'She was deeply sentimental.' Avoid: outrage, sentimentality, breathless excitement, despair, and any emotion that requires exclamation marks. When touching on difficult subjects, maintain steady composure — let the facts carry the weight. Never tell the reader how to feel ('This is heartbreaking', 'You'll be amazed'). The emotional range is a warm minor key: mostly steady, occasionally poignant, never melodramatic.",